{
 "schemaVersion": 1,
 "kapitel": 10,
 "titel": "Studies and curiosities",
 "abschnitte": [
  {
   "nummer": "10.1",
   "label": "sec:k10-werkzeug",
   "titel": "Dein Werkzeug: So löst du eine Studie"
  },
  {
   "nummer": "10.2",
   "label": "sec:k10-saavedra",
   "titel": "Die Saavedra-Studie: Unterverwandlung gegen Patt"
  },
  {
   "nummer": "10.3",
   "label": "sec:k10-reti",
   "titel": "Die Réti-Studie: ein Königsweg mit zwei Zielen"
  },
  {
   "nummer": "10.4",
   "label": "sec:k10-heuaecker",
   "titel": "Die Heuäcker-Studie: Wegversperrung"
  },
  {
   "nummer": "10.5",
   "label": "sec:k10-kuriositaeten",
   "titel": "Zwei Kuriositäten"
  },
  {
   "nummer": "10.6",
   "label": "",
   "titel": "Rückblick: Studien und Kuriositäten"
  }
 ],
 "abbildungen": [
  {
   "id": "10.1",
   "auflage": 1,
   "kapitel": 10,
   "abschnitt": {
    "nummer": "10.2",
    "label": "sec:k10-saavedra",
    "titel": "Die Saavedra-Studie: Unterverwandlung gegen Patt"
   },
   "unterabschnitt": null,
   "fen": "8/8/1KP5/3r4/8/8/8/k7 w - - 0 1",
   "pfeile": [
    {
     "farbe": "gold",
     "von": "c6",
     "nach": "c8"
    }
   ],
   "felder": [],
   "unterschrift": [
    {
     "art": "text",
     "text": "Die Saavedra-Studie, Weiß am Zug gewinnt. Goldener Pfeil: der Weg des Bauern.",
     "stil": "normal"
    }
   ],
   "art": "fliesstext",
   "reihe": [
    "10.2",
    "10.3"
   ],
   "beispiel": {
    "id": "k10-a1",
    "pfad": []
   },
   "quelle": {
    "datei": "kap10_studien.tex",
    "zeile": 70
   },
   "pruefsumme": "ae76f2da49a9d665",
   "vorbereitet": {
    "status": "freigegeben",
    "fragen": [
     {
      "zug": "1. c7",
      "frage": "Warum zieht Weiß sofort 1. c7?",
      "antworten": [
       "Damit setzt Weiß den schwarzen König patt.",
       "Der Bauer steht vor dem Ziel, und der Turm kann ihn nur noch mit Schachs stören.",
       "Der Bauer deckt auf c7 den eigenen König."
      ],
      "richtig": 1,
      "erklaerung": "Ein Turmzug nach d8 scheitert am Schlag cxd8. Schwarz bleibt nur, mit Schachs Zeit zu gewinnen."
     }
    ]
   }
  },
  {
   "id": "10.2",
   "auflage": 1,
   "kapitel": 10,
   "abschnitt": {
    "nummer": "10.2",
    "label": "sec:k10-saavedra",
    "titel": "Die Saavedra-Studie: Unterverwandlung gegen Patt"
   },
   "unterabschnitt": null,
   "fen": "8/2P5/8/1K1r4/8/8/8/k7 w - - 3 3",
   "pfeile": [],
   "felder": [
    {
     "farbe": "grau",
     "feld": "c2"
    }
   ],
   "unterschrift": [
    {
     "art": "text",
     "text": "Nach ",
     "stil": "normal"
    },
    {
     "art": "zug",
     "text": "1. c7 Td6+ 2. Kb5 Td5+"
    },
    {
     "art": "text",
     "text": ", Weiß am Zug. Grau: Dorthin läuft der König.",
     "stil": "normal"
    }
   ],
   "art": "fliesstext",
   "reihe": [
    "10.1",
    "10.3"
   ],
   "beispiel": {
    "id": "k10-a1",
    "pfad": [
     "c7",
     "Rd6+",
     "Kb5",
     "Rd5+"
    ]
   },
   "quelle": {
    "datei": "kap10_studien.tex",
    "zeile": 71
   },
   "pruefsumme": "5a99f8f3be4e1b5e"
  },
  {
   "id": "10.3",
   "auflage": 1,
   "kapitel": 10,
   "abschnitt": {
    "nummer": "10.2",
    "label": "sec:k10-saavedra",
    "titel": "Die Saavedra-Studie: Unterverwandlung gegen Patt"
   },
   "unterabschnitt": null,
   "fen": "8/2P5/8/8/8/1K1r4/8/k7 w - - 7 5",
   "pfeile": [
    {
     "farbe": "gold",
     "von": "b3",
     "nach": "c2"
    }
   ],
   "felder": [],
   "unterschrift": [
    {
     "art": "text",
     "text": "Nach ",
     "stil": "normal"
    },
    {
     "art": "zug",
     "text": "3. Kb4 Td4+ 4. Kb3 Td3+"
    },
    {
     "art": "text",
     "text": ", Weiß am Zug. Goldener Pfeil: Nach ",
     "stil": "normal"
    },
    {
     "art": "zug",
     "text": "5. Kc2"
    },
    {
     "art": "text",
     "text": " kostet jedes weitere Schach den Turm.",
     "stil": "normal"
    }
   ],
   "art": "fliesstext",
   "reihe": [
    "10.1",
    "10.2"
   ],
   "beispiel": {
    "id": "k10-a1",
    "pfad": [
     "c7",
     "Rd6+",
     "Kb5",
     "Rd5+",
     "Kb4",
     "Rd4+",
     "Kb3",
     "Rd3+"
    ]
   },
   "quelle": {
    "datei": "kap10_studien.tex",
    "zeile": 72
   },
   "pruefsumme": "67b165d1cae656e4",
   "vorbereitet": {
    "status": "freigegeben",
    "fragen": [
     {
      "zug": "5. Kc2",
      "frage": "Warum geht der König jetzt nach c2?",
      "antworten": [
       "Weiß will die Stellung wiederholen und remis machen.",
       "Er will den Bauern c7 von hinten decken.",
       "Von c2 aus deckt er c3 und d2: Jedes weitere Schach kostet den Turm."
      ],
      "richtig": 2,
      "erklaerung": "Der Turm hat keine sicheren Schachs mehr. Schwarz muss sich etwas Neues einfallen lassen."
     }
    ]
   }
  },
  {
   "id": "10.4",
   "auflage": 1,
   "kapitel": 10,
   "abschnitt": {
    "nummer": "10.2",
    "label": "sec:k10-saavedra",
    "titel": "Die Saavedra-Studie: Unterverwandlung gegen Patt"
   },
   "unterabschnitt": null,
   "fen": "8/2P5/8/2K5/8/8/8/k2r4 w - - 3 3",
   "pfeile": [
    {
     "farbe": "rot",
     "von": "d1",
     "nach": "c1"
    }
   ],
   "felder": [],
   "unterschrift": [
    {
     "art": "text",
     "text": "Nach ",
     "stil": "normal"
    },
    {
     "art": "zug",
     "text": "1. c7 Td6+ 2. Kc5? Td1"
    },
    {
     "art": "text",
     "text": ", Weiß am Zug: remis. Roter Pfeil: Nach ",
     "stil": "normal"
    },
    {
     "art": "zug",
     "text": "3. c8=D?"
    },
    {
     "art": "text",
     "text": " spießt Tc1+ König und Dame auf.",
     "stil": "normal"
    }
   ],
   "art": "fliesstext",
   "reihe": [
    "10.5"
   ],
   "beispiel": {
    "id": "k10-a1",
    "pfad": [
     "c7",
     "Rd6+",
     "Kc5",
     "Rd1"
    ]
   },
   "quelle": {
    "datei": "kap10_studien.tex",
    "zeile": 82
   },
   "pruefsumme": "0c80ccab32616bf2",
   "vorbereitet": {
    "status": "freigegeben",
    "fragen": [
     {
      "zug": "3. c8=Q",
      "frage": "Warum ist 3. c8=D hier ein Fehler?",
      "antworten": [
       "Tc1+ spießt König c5 und Dame c8 auf der c-Linie auf.",
       "Die neue Dame setzt den schwarzen König patt.",
       "Der Turm d1 kann die Dame sofort schlagen."
      ],
      "richtig": 0,
      "erklaerung": "Der König muss aus dem Schach, dann schlägt der Turm die Dame. Mit 2. Kc5? stand der König auf der falschen Linie."
     }
    ]
   }
  },
  {
   "id": "10.5",
   "auflage": 1,
   "kapitel": 10,
   "abschnitt": {
    "nummer": "10.2",
    "label": "sec:k10-saavedra",
    "titel": "Die Saavedra-Studie: Unterverwandlung gegen Patt"
   },
   "unterabschnitt": null,
   "fen": "8/1KPr4/8/8/8/8/8/k7 w - - 3 3",
   "pfeile": [
    {
     "farbe": "grau",
     "von": "d7",
     "nach": "b7"
    }
   ],
   "felder": [
    {
     "farbe": "rot",
     "feld": "c7"
    }
   ],
   "unterschrift": [
    {
     "art": "text",
     "text": "Nach ",
     "stil": "normal"
    },
    {
     "art": "zug",
     "text": "1. c7 Td6+ 2. Kb7? Td7"
    },
    {
     "art": "text",
     "text": ", Weiß am Zug: remis. Grauer Pfeil: die Fesselung. Rot: Der Bauer c7 darf nicht ziehen.",
     "stil": "normal"
    }
   ],
   "art": "fliesstext",
   "reihe": [
    "10.4"
   ],
   "beispiel": {
    "id": "k10-a1",
    "pfad": [
     "c7",
     "Rd6+",
     "Kb7",
     "Rd7"
    ]
   },
   "quelle": {
    "datei": "kap10_studien.tex",
    "zeile": 83
   },
   "pruefsumme": "97bc9c3d78751450",
   "vorbereitet": {
    "status": "freigegeben",
    "fragen": [
     {
      "frage": "Warum kommt Weiß hier nicht weiter?",
      "antworten": [
       "Der weiße König hat keine Felder mehr.",
       "Schwarz droht Matt auf der a-Linie.",
       "Der Turm d7 fesselt den Bauern c7 an den König b7."
      ],
      "richtig": 2,
      "erklaerung": "Der Bauer darf nicht ziehen, solange er den eigenen König deckt. Zieht der König weg, schlägt der Turm den Bauern."
     }
    ]
   }
  },
  {
   "id": "10.6",
   "auflage": 1,
   "kapitel": 10,
   "abschnitt": {
    "nummer": "10.2",
    "label": "sec:k10-saavedra",
    "titel": "Die Saavedra-Studie: Unterverwandlung gegen Patt"
   },
   "unterabschnitt": null,
   "fen": "8/2P5/8/8/3r4/8/2K5/k7 w - - 9 6",
   "pfeile": [
    {
     "farbe": "rot",
     "von": "d4",
     "nach": "c4"
    }
   ],
   "felder": [],
   "unterschrift": [
    {
     "art": "text",
     "text": "Nach ",
     "stil": "normal"
    },
    {
     "art": "zug",
     "text": "5. Kc2 Td4!!"
    },
    {
     "art": "text",
     "text": ", Weiß am Zug. Roter Pfeil: das geplante Turmopfer auf c4.",
     "stil": "normal"
    }
   ],
   "art": "fliesstext",
   "reihe": [],
   "beispiel": {
    "id": "k10-a1",
    "pfad": [
     "c7",
     "Rd6+",
     "Kb5",
     "Rd5+",
     "Kb4",
     "Rd4+",
     "Kb3",
     "Rd3+",
     "Kc2",
     "Rd4"
    ]
   },
   "quelle": {
    "datei": "kap10_studien.tex",
    "zeile": 95
   },
   "pruefsumme": "dbd8a7c4d906e120",
   "vorbereitet": {
    "status": "freigegeben",
    "fragen": [
     {
      "zug": "6. c8=R",
      "frage": "Warum wandelt Weiß in einen Turm um und nicht in eine Dame?",
      "antworten": [
       "Ein Turm auf c8 ist vor allen Schachs sicher.",
       "Nach c8=D gibt Tc4+, und nach Dxc4 ist Schwarz patt.",
       "Eine Dame auf c8 könnte Schwarz sofort schlagen."
      ],
      "richtig": 1,
      "erklaerung": "Die Dame auf c4 würde auch a2 decken. Ein Turm auf c4 deckt a2 nicht, also gibt es kein Patt."
     }
    ]
   }
  },
  {
   "id": "10.7",
   "auflage": 1,
   "kapitel": 10,
   "abschnitt": {
    "nummer": "10.2",
    "label": "sec:k10-saavedra",
    "titel": "Die Saavedra-Studie: Unterverwandlung gegen Patt"
   },
   "unterabschnitt": null,
   "fen": "8/8/8/8/2Q5/8/2K5/k7 b - - 0 7",
   "pfeile": [
    {
     "farbe": "grau",
     "von": "c4",
     "nach": "a2"
    }
   ],
   "felder": [
    {
     "farbe": "grau",
     "feld": "a2"
    },
    {
     "farbe": "grau",
     "feld": "b1"
    },
    {
     "farbe": "grau",
     "feld": "b2"
    }
   ],
   "unterschrift": [
    {